question,correct_answer,zero_shot_answer,zero_shot_correct,zero_shot_inference_time,cot_answer,cot_correct,cot_inference_time,react_answer,react_correct,react_inference_time
Let M be a 5 x 5 real matrix. Exactly four of the following five conditions on M are equivalent to each other. Which of the five conditions is equivalent to NONE of the other four?,"For any two distinct column vectors u and v of M, the set {u, v} is linearly independent. 1","For any two distinct column vectors u and v of M, the set {u, v} is linearly independent. 1",True,2.4730 seconds,The system of equations Mx = b has a unique solution for each real 5 x 1 column vector b. 1,False,0.1520 seconds,,False,8.9643 seconds
How many positive numbers x satisfy the equation cos(97x) = x?,31 1,31 1,True,2.1809 seconds,15 1,False,2.9432 seconds,49 1,False,6.9931 seconds
For which of the following rings is it possible for the product of two nonzero elements to be zero?,"The ring of continuous real-valued functions on [0, 1] 1","The ring of continuous real-valued functions on [0, 1] 1",True,0.7812 seconds,The ring {a + b * sqrt(2) : a and b are rational numbers} 1,False,2.8881 seconds,"The ring of continuous real-valued functions on [0, 1] 1",True,9.3237 seconds
The map x -> axa^2 of a group G into itself is a homomorphism if and only if,a^3 = e 1,a^3 = e 1,True,0.3929 seconds,a^3 = e 1,True,2.0744 seconds,,False,3.6164 seconds
"If A is the 2 by 2 matrix whose (i, j) entry is equal to i + j, and B is the 3 by 3 matrix whose (i, j) entry is equal to i + j, find the value of the sum detA + detB.",-1 1,2 1,False,0.2641 seconds,,False,2.0773 seconds,0 1,False,9.9550 seconds
"If f : (0, 1) → (0, 1], then which of the following could be TRUE?
I. f is one-to-one and onto.
II. The image of f is compact.
III. f is continuous, one-to-one, and onto.",I and II only 1,I and II only 1,True,2.5095 seconds,I and II only 1,True,0.4830 seconds,,False,4.4680 seconds
"If a real number x is chosen at random in the interval [0, 3] and a real number y is chosen at random in the interval [0, 4], what is the probability that x < y?",5/8 1,5/8 1,True,0.5497 seconds,,False,1.9741 seconds,,False,3.4666 seconds
"The probability that a point (x, y) in R^2 is chosen follows a uniform random distribution within the region described by the inequality 0 < |x| + |y| < 1 . What is the probability that 2(x + y) > 1?",1/4 1,,False,1.8550 seconds,1/sqrt(2) 1,False,2.3125 seconds,1/4 1,True,5.4338 seconds
(1+i)^10 =,32i 1,32i 1,True,0.5944 seconds,i 1,False,2.3641 seconds,1 1,False,4.5741 seconds
"If U and V are 3-dimensional subspaces of R^5, what are the possible dimensions of U ∩ V?","1, 2, or 3 1","1, 2, or 3 1",True,2.4345 seconds,"1, 2, or 3 1",True,2.6487 seconds,"1, 2, or 3 1",True,8.2208 seconds
"Let S be the subset of R^2 consisting of all points (x, y) in the unit square [0, 1] × [0, 1] for which x or y, or both, are irrational. With respect to the standard topology on R^2, S is",connected 1,totally disconnected 1,False,1.7154 seconds,connected 1,True,0.1066 seconds,closed 1,False,5.4333 seconds
Which of the following circles has the greatest number of points of intersection with the parabola x^2 = y + 4 ?,x^2 + y^2 = 9 1,x^2 + y^2 = 9 1,True,0.1529 seconds,x^2 + y^2 = 9 1,True,0.7799 seconds,x^2 + y^2 = 9 1,True,9.0637 seconds
X is a finite set with the following property: The number of subsets of X that contain exactly 3 elements is 14 more than the number of subsets of X that contain exactly 2 elements. How many subsets of X contain exactly 4 elements?,35 1,,False,0.4259 seconds,28 1,False,1.2551 seconds,28 1,False,5.1950 seconds
"Let T: R^2 -> R^2 be the linear transformation that maps the point (1, 2) to (2, 3) and the point (-1, 2) to (2, -3). Then T maps the point (2, 1) to","(1, 6) 1","(1, 6) 1",True,2.0955 seconds,"(-4, 3) 1",False,1.7989 seconds,"(1, 6) 1",True,3.3491 seconds
