question,correct_answer,zero_shot_answer,zero_shot_correct,zero_shot_inference_time,cot_answer,cot_correct,cot_inference_time,react_answer,react_correct,react_inference_time
"Let k be the number of real solutions of the equation e^x + x - 2 = 0 in the interval [0, 1], and let n be the number of real solutions that are not in [0, 1]. Which of the following is true?",k = 1 and n = 0 1,k = 1 and n = 0 1,True,0.7115 seconds,k > 1 1,False,1.7338 seconds,k = 1 and n = 0 1,True,5.4215 seconds
"Up to isomorphism, how many additive abelian groups G of order 16 have the property that x + x + x + x = 0 for each x in G ?",3 1,3 1,True,1.4493 seconds,3 1,True,0.3531 seconds,2 1,False,5.9058 seconds
"Suppose P is the set of polynomials with coefficients in Z_5 and degree less than or equal to 7. If the operator D sends p(x) in P to its derivative p′(x), what are the dimensions of the null space n and range r of D?",n = 2 and r = 6 1,n = 2 and r = 6 1,True,2.7134 seconds,n = 1 and r = 7 1,False,2.2368 seconds,n = 2 and r = 6 1,True,7.2482 seconds
The shortest distance from the curve xy = 8 to the origin is,4 1,16 1,False,2.0431 seconds,4 1,True,1.1526 seconds,4 1,True,7.6024 seconds
"There are 25 suitcases, 5 of which are damaged. Three suitcases are selected at random. What is the probability that exactly 2 are damaged?",2/23 1,2/23 1,True,0.1614 seconds,,False,1.2579 seconds,1/30 1,False,7.3537 seconds
"Let (Z_{10} , +, x) be the ring of integers modulo 10, and let S be the subset of Z_{10} represented by {0, 2, 4, 6, 8}. Which of the following statements is FALSE?","(S, +, x) has no identity under multiplication modulo 10. 1","(S, +, x) has no identity under multiplication modulo 10. 1",True,2.6119 seconds,"(S, +, x) has no identity under multiplication modulo 10. 1",True,0.0634 seconds,"(S, +, x) is closed under addition modulo 10. 1",False,3.8420 seconds
"A ladder 9 meters in length is leaning against a vertical wall on level ground. As the bottom end of the ladder is moved away from the wall at a constant rate of 2 meters per second, the top end slides downward along the wall. How fast, in meters per second, will the top end of the ladder be sliding downward at the moment the top end is 3 meters above the ground?",4*sqrt(2) 1,4*sqrt(2) 1,True,2.4466 seconds,4*sqrt(2) 1,True,2.9723 seconds,4*sqrt(2) 1,True,6.6015 seconds
Consider a segment of length 10. Points A and B are chosen randomly such that A and B divide the segment into three smaller segments. What is the probability that the three smaller segments could form the sides of a triangle?,25% 1,10% 1,False,0.3261 seconds,0 1,False,2.2498 seconds,50% 1,False,6.2077 seconds
"Let V be a finite-dimensional real vector space and let P be a linear transformation of V such that P^2 = P. Which of the following must be true?
I. P is invertible.
II. P is diagonalizable.
III. P is either the identity transformation or the zero transformation.",II only 1,II only 1,True,1.1949 seconds,II only 1,True,0.9548 seconds,,False,8.6686 seconds
Which of the following is true?,Every compact space is complete 1,Every compact space is complete 1,True,1.8944 seconds,Every compact space is complete 1,True,2.9895 seconds,Every compact space is complete 1,True,9.6294 seconds
A discrete graph is complete if there is an edge connecting any pair of vertices. How many edges does a complete graph with 10 vertices have?,45 1,45 1,True,1.7137 seconds,45 1,True,2.6596 seconds,20 1,False,8.9913 seconds
"Suppose X is a discrete random variable on the set of positive integers such that for each positive integer n, the probability that X = n is 1/2^n. If Y is a random variable with the same probability distribution and X and Y are independent, what is the probability that the value of at least one of the variables X and Y is greater than 3 ?",15/64 1,3/8 1,False,2.9162 seconds,15/64 1,True,0.6014 seconds,,False,9.5208 seconds
Let V and W be 4-dimensional subspaces of a 7-dimensional vector space X. Which of the following CANNOT be the dimension of the subspace V intersect W?,0 1,0 1,True,2.8684 seconds,0 1,True,0.6884 seconds,0 1,True,7.6589 seconds
"A large class is to be divided into teams and each student must be a member of exactly one team. However, each student dislikes three of their classmates. Dislike between students need not be mutual. If the teams do not need to be equally sized, how many must be created so that no student is the teammate of someone they dislike?",7 1,7 1,True,0.0044 seconds,4 1,False,2.6961 seconds,10 1,False,7.4580 seconds
Sofia and Tess will each randomly choose one of the 10 integers from 1 to 10. What is the probability that neither integer chosen will be the square of the other?,0.95 1,0.72 1,False,2.5775 seconds,0.95 1,True,0.8316 seconds,0.72 1,False,4.6718 seconds
"Let K be a nonempty subset of R^n, where n > 1. Which of the following statements must be true?
I. If K is compact, then every continuous real-valued function defined on K is bounded.
II. If every continuous real-valued function defined on K is bounded, then K is compact.
III. If K is compact, then K is connected.",I and II only 1,I and II only 1,True,0.2311 seconds,I only 1,False,1.5152 seconds,I and II only 1,True,6.8136 seconds
"Suppose V is a real vector space of finite dimension n. Call the set of matrices from V into itself M(V). Let T be in M(V). Consider the two subspaces U = {X ∈ M(V) : TX = XT} and W = {TX − XT : X ∈ M(V)}. Which of the following must be TRUE?
I. If V has a basis containing only eigenvectors of T then U = M(V).
II. dim (U) + dim (W) = n^2
III. dim (U) < n",II only 1,II only 1,True,1.9751 seconds,II only 1,True,1.2726 seconds,II only 1,True,6.2649 seconds
"Let F be a constant unit force that is parallel to the vector (-1, 0, 1) in xyz-space. What is the work done by F on a particle that moves along the path given by (t, t^2, t^3) between time t=0 and time t=1?",0 1,0 1,True,1.9747 seconds,0 1,True,0.6548 seconds,0 1,True,4.7586 seconds
"Let X be a topological space, and let A, B, and C be nonempty subsets of X such that A c B c C; that is, A is a proper subset of B, and B is a proper subset of C. Which of the following statements is (are) true?
I. If A and C are connected, then B is connected.
II. If A and C are compact, then B is compact.
III. If A and C are Hausdorff, then B is Hausdorff.","I, II, and III 1","I, II, and III 1",True,2.2196 seconds,I and II only 1,False,1.7640 seconds,I and II only 1,False,3.7310 seconds
"Let x_1 = 1 and x_(n+1) = sqrt(3+2x_n) for all positive integers n. If it is assumed that {x_n} converges, then lim x_n =",3 1,3 1,True,1.4452 seconds,sqrt(5) 1,False,2.6557 seconds,3 1,True,9.6451 seconds
"If v is an eigenvector of an invertible matrix A, then which of the following is I are necessarily
true?
I. v is also an eigenvector of 2A.
II. v is also an eigenvector of A^2.
III. v is also an eigenvector of A^(-1).","I, II, and III 1","I, II, and III 1",True,0.4102 seconds,"I, II, and III 1",True,0.6292 seconds,"I, II, and III 1",True,5.9163 seconds
For how many positive integers k does the ordinary decimal representation of the integer k! end in exactly 99 zeros?,Five 1,Five 1,True,0.8109 seconds,One 1,False,2.3606 seconds,Five 1,True,3.0031 seconds
"Let R be a ring with a multiplicative identity. If U is an additive subgroup of R such that ur in U for all u in U and for all r in R, then U is said to be a right ideal of R. If R has exactly two right ideals, which of the following must be true?
I. R is commutative.
II. R is a division ring (that is, all elements except the additive identity have multiplicative inverses).
III. R is infinite.",II only 1,I and II only 1,False,2.9362 seconds,II only 1,True,0.3854 seconds,II only 1,True,8.2652 seconds
"A six-sided die (whose faces are numbered 1 through 6, as usual) is known to be counterfeit: The probability of rolling any even number is twice the probability of rolling any odd number. What is the probability that if this die is thrown twice, the first roll will be a 5 and the second roll will be a 6?",2/81 1,2/81 1,True,0.5149 seconds,1/18 1,False,0.5659 seconds,2/81 1,True,8.9240 seconds
Statement 1 | Suppose {s_n} and {t_n} are sequences of complex numbers such that lim_n→∞ s_n = s and lim_n→∞ tn = t. lim_n→∞ s_nt_n = st. Statement 2 | There exists a bounded sequence of real numbers with no convergent subsequence.,"True, False 1","True, False 1",True,0.5901 seconds,"True, True 1",False,0.6498 seconds,"True, False 1",True,3.5357 seconds
"Define a binary operation on Z, the set of integers, by the equation m • n = m + n + mn. Which of
the following statements is (are) true about the binary structure (Z, • )?
I. This structure is not a group since the operation is not associative.
II. This structure is not a group since there is no identity element.
III. This structure is not a group since not all elements have an inverse.
IV. This structure is a group.",III only 1,III only 1,True,0.1179 seconds,,False,2.7028 seconds,III only 1,True,9.2107 seconds
"It takes Kate k days to write a GRE math practice test. It takes John j days to write a GRE math practice test. If Kate and John work on a practice test in alternating 2-day shifts, it takes them 10 days when Kate starts and 10.5 days when John starts. How long would it take the two to complete a practice test if Kate and John worked simultaneously?",36/7 days 1,41/8 days 1,False,1.3844 seconds,36/7 days 1,True,0.2795 seconds,36/7 days 1,True,9.8911 seconds
What is the greatest possible area of a triangular region with one vertex at the center of a circle of radius 1 and the other two vertices on the circle?,1/2 1,1 1,False,0.1523 seconds,pi 1,False,2.3112 seconds,1/2 1,True,9.3421 seconds
"Let f(x,y) = x^2 - 2xy + y^3 for all real x and y. Which of the following is true?",f has all of its relative extrema on the line x = y. 1,"f has an absolute minimum at (2/3, 2/3). 1",False,1.9203 seconds,"f has an absolute minimum at (2/3, 2/3). 1",False,0.1430 seconds,f has all of its relative extrema on the line x = y. 1,True,3.8002 seconds
What is the largest order of an element in the group of permutations of 5 objects?,6 1,6 1,True,1.4104 seconds,6 1,True,2.6868 seconds,6 1,True,7.9840 seconds
"S(n) is a statement about positive integers n such that whenever S(k) is true, S(k + 1) must also be true. Furthermore, there exists some positive integer n0 such that S(n0) is not true. Of the following, which is the strongest conclusion that can be drawn?",S(n) is not true for any n <= n0 1,S(n) is not true for any n <= n0 1,True,1.3925 seconds,S(n) is not true for any n <= n0 1,True,1.9834 seconds,S(n) is not true for any n >= n0 1,False,3.3373 seconds
"In xyz-space, what are the coordinates of the point on the plane 2x + y + 3z = 3 that is closest to the origin?","(3/7, 3/14, 9/14) 1","(0, 0, 1) 1",False,0.6742 seconds,,False,0.0100 seconds,"(3/7, 3/14, 9/14) 1",True,8.5138 seconds
For which integers n such that 3 <= n <= 11 is there only one group of order n (up to isomorphism)?,"For 3, 5, 7, and 11 only 1","For 4, 6, 8, and 10 only 1",False,2.4739 seconds,"For 3, 5, 7, and 11 only 1",True,1.4368 seconds,"For 3, 5, 7, and 11 only 1",True,9.0634 seconds
A tree is a connected graph with no cycles. How many nonisomorphic trees with 5 vertices exist?,3 1,2 1,False,1.5921 seconds,3 1,True,1.9848 seconds,3 1,True,3.7269 seconds
"Suppose A and B are n x n invertible matrices, where n > 1, and I is the n x n identity matrix. If A and B are similar matrices, which of the following statements must be true?	I. A - 2I and B - 2I are similar matrices. II. A and B have the same trace.	 III. A^-1 and B^-1 are similar matrices.","I, II, and III 1","I, II, and III 1",True,0.5646 seconds,"I, II, and III 1",True,0.0724 seconds,"I, II, and III 1",True,8.5642 seconds
"Let C be the circle in the yz-plane whose equation is (y - 3)^2 + z^2 = 1. If C is revolved around the z-axis, the surface generated is a torus. What is the equation of this torus?",(x^2 + y^2 + z^2 + 8)^2 = 36(x^2 + y^2) 1,(x^2 + y^2 + z^2 + 8)^2 = 36(x^2 + y^2) 1,True,1.3761 seconds,,False,1.9469 seconds,x^2 + y^2 + z^2 + 8 = 6y 1,False,8.3512 seconds
Which of the following is an equation of the line tangent to the graph of y = x + e^x at x = 0 ?,y = 2x + 1 1,y = 2x 1,False,0.7621 seconds,,False,0.7913 seconds,,False,3.9816 seconds
"Let V be the real vector space of all real 2 x 3 matrices, and let W be the real vector space of all real 4 x 1 column vectors. If T is a linear transformation from V onto W, what is the dimension of the subspace kernel of T?",2 1,2 1,True,1.5746 seconds,2 1,True,0.3297 seconds,2 1,True,6.1081 seconds
Statement 1 |  Suppose ∑|a_i| diverges and ∑ a_i = 2. There is a rearrangement a_i_k of the terms such that ∑ a_i_k = 4. Statement 2 | There exists metric spaces X and Y with X closed and bounded and a continuous mapping f : X → Y such that f(X) is NOT “closed and bounded”.,"True, True 1","False, False 1",False,2.9140 seconds,"False, True 1",False,2.6166 seconds,"True, True 1",True,9.8075 seconds
The maximum number of acute angles in a convex 10-gon in the Euclidean plane is,3 1,,False,0.0433 seconds,3 1,True,1.1057 seconds,3 1,True,3.4704 seconds
"If f(z) is an analytic function that maps the entire finite complex plane into the real axis, then the imaginary axis must be mapped onto",a point 1,a point 1,True,0.3739 seconds,a point 1,True,2.8224 seconds,a point 1,True,9.4237 seconds
"A group G in which (ab)^2 = a^2b^2 for all a, b in G is necessarily",abelian 1,abelian 1,True,2.7562 seconds,cyclic 1,False,2.9220 seconds,abelian 1,True,6.4499 seconds
"If f is a continuously differentiable real-valued function defined on the open interval (-1, 4) such that f(3) = 5 and f'(x) ≥ -1 for all x, what is the greatest possible value of f(0)?",8 1,,False,2.4301 seconds,4 1,False,1.0907 seconds,3 1,False,7.4482 seconds
"Suppose A and B are n × n matrices with real entries. Which of the follow are TRUE?
I. The trace of A^2 is nonnegative.
II. If A^2 = A, then the trace of A is nonnegative.
III. The trace of AB is the product of the traces of A and B.",II only 1,I and II only 1,False,1.1442 seconds,II only 1,True,1.5399 seconds,II only 1,True,6.4682 seconds
What is the units digit in the standard decimal expansion of the number 7^25?,7 1,7 1,True,1.8207 seconds,,False,1.6039 seconds,5 1,False,5.0996 seconds
"Statement 1 | f : X → Y is continuous and X is compact. f must be uniformly continuous. Statement 2 | If f(x), g(x) : R → R are everywhere differentiable f(g(x)) must be everywhere differentiable.","True, True 1","True, True 1",True,1.5054 seconds,"True, True 1",True,0.0576 seconds,"True, True 1",True,3.7752 seconds
The region bounded by the curves y = x and y = x^2 in the first quadrant of the xy-plane is rotated about the y-axis. The volume of the resulting solid of revolution is,π/6 1,π/6 1,True,2.6189 seconds,π/6 1,True,2.0241 seconds,,False,6.4934 seconds
"In the xy-plane, the curve with parametric equations x = cos t and y = sin t, 0 <= t <= pi, has length",pi 1,pi 1,True,0.8830 seconds,pi 1,True,1.1847 seconds,pi 1,True,3.8313 seconds
"Which of the following are valid intervals of convergence for a power series?
(I) [−1, 3)
(II) (−∞, 0]
(III) [2, 2] ∪ [3, 3]
(IV) (−∞,∞)",(I) and (IV ) 1,(I) and (IV ) 1,True,1.3669 seconds,Only (II) 1,False,1.5386 seconds,Only (II) 1,False,5.7640 seconds
"If f: R -> R is a bounded function that is Lebesgue integrable, then which of the following must be true?",None of the above. 1,None of the above. 1,True,1.6279 seconds,None of the above. 1,True,2.8230 seconds,None of the above. 1,True,4.0126 seconds
"In the xy-plane, the graph of x^(log y) = y^log x is",the open first quadrant 1,the open first quadrant 1,True,0.8246 seconds,the open first quadrant 1,True,2.9843 seconds,a single point 1,False,8.1501 seconds
For which p is the norm ||x||_p expressable as an inner product?,2 1,2 1,True,0.4655 seconds,2 1,True,2.4211 seconds,infinity 1,False,8.2195 seconds
"Let S be a compact topological space, let T be a topological space, and let f be a function from S onto T. Of the following conditions on f, which is the weakest condition sufficient to ensure the compactness of T?",f is continuous. 1,f is continuous. 1,True,2.3874 seconds,f is continuous. 1,True,0.4289 seconds,f is a homeomorphism. 1,False,3.4344 seconds
What is the area of an equilateral triangle whose inscribed circle has radius 2?,12*sqrt(3) 1,16*sqrt(3) 1,False,2.8182 seconds,12*sqrt(3) 1,True,2.2327 seconds,16*sqrt(3) 1,False,9.8216 seconds
For which value of n are there exactly two abelian groups of order n up to isomorphism?,4 1,,False,1.1595 seconds,4 1,True,0.3798 seconds,8 1,False,7.0540 seconds
"Which of the following is not always true for x, y, z ∈ R^k?",|x + y| = |x| + |y| 1,|x + y| = |x| + |y| 1,True,2.7623 seconds,|x + y| = |x| + |y| 1,True,1.7783 seconds,,False,3.8223 seconds
"Let V be the vector space, under the usual operations, of real polynomials that are of degree at most 3. Let W be the subspace of all polynomials p (x) in V such that p (0) = p(1) = p(-1) = 0. Then dim V + dim W is",5 1,5 1,True,1.0964 seconds,5 1,True,1.8877 seconds,5 1,True,6.0931 seconds
"If V and W are 2-dimensional subspaces of R^4 ,what are the possible dimensions of the subspace V intersect W?","0, 1, and 2 only 1","0, 1, and 2 only 1",True,1.7259 seconds,"0, 1, and 2 only 1",True,2.1970 seconds,1 only 1,False,3.6219 seconds
"The curves y = (sin x + cos x)^4 and y = (sin x - cos x)^4 intersect at x = 0. If a is the smallest positive value of x at which these curves next intersect, determine the area between these curves from x = 0 to x = a.",4 1,4 1,True,0.0072 seconds,4 1,True,0.2431 seconds,3π/2 1,False,4.7705 seconds
"If f is a linear transformation from the plane to the real numbers and if f(1, 1) = 1 and f(-1, 0) = 2, then f(3, 5) =",9 1,0 1,False,2.4131 seconds,9 1,True,0.8849 seconds,9 1,True,6.9511 seconds
How many real roots does the polynomial 2x^5 + 8x - 7 have?,One 1,One 1,True,1.1634 seconds,Two 1,False,1.9381 seconds,None 1,False,8.2156 seconds
"A university’s mathematics department has 10 professors and will offer 20 different courses next semester. Each professor will be assigned to teach exactly 2 of the courses, and each course will have exactly one professor assigned to teach it. If any professor can be assigned to teach any course, how many different complete assignments of the 10 professors to the 20 courses are possible?",20!/2^(10) 1,,False,0.1093 seconds,20!/2^(10) 1,True,2.0157 seconds,,False,5.8100 seconds
Which of the following are true:,"It is possible to place an linear order relation ≤ on the complex numbers C such that (C, +, ×, ≤) is not an ordered field. 1","It is possible to place an linear order relation ≤ on the complex numbers C such that (C, +, ×, ≤) is not an ordered field. 1",True,0.6342 seconds,"It is possible to place an linear order relation ≤ on the complex numbers C such that (C, +, ×, ≤) is not an ordered field. 1",True,2.8354 seconds,"It is possible to place a linear order relation on the complex numbers C which make (C, +, ×, ≤) an ordered field. 1",False,7.9957 seconds
In a game two players take turns tossing a fair coin; the winner is the first one to toss a head. The probability that the player who makes the first toss wins the game is,2/3 1,2/3 1,True,0.8574 seconds,2/3 1,True,2.6840 seconds,1/2 1,False,8.9088 seconds
Which of the following is NOT a group?,The nonzero integers under multiplication 1,The nonzero integers under multiplication 1,True,1.4343 seconds,The nonzero integers under multiplication 1,True,2.2778 seconds,,False,6.9959 seconds
Let x and y be positive integers such that 3x + 7y is divisible by 11. Which of the following must also be divisible by 11?,4x - 9y 1,4x - 9y 1,True,2.0693 seconds,4x - 9y 1,True,0.8794 seconds,4x - 9y 1,True,8.6447 seconds
"What is the minimum value of the expression x + 4z as a function defined on R^3, subject to the constraint x^2 + y^2 + z^2 <= 2?",-sqrt(34) 1,-sqrt(34) 1,True,1.5390 seconds,-sqrt(34) 1,True,0.1360 seconds,-sqrt(34) 1,True,6.3224 seconds
"Let R be a ring and let U and V be (two-sided) ideals of R. Which of the following must also be ideals of R ?
I. {u + v : u \in and v \in V}
II. {uv : u \in U and v \in V}
III. {x : x \in U and x \in V}",I and III only 1,I and III only 1,True,1.8748 seconds,II only 1,False,1.3158 seconds,III only 1,False,7.6973 seconds
The region bounded by the x-axis and the function f(x) = x/(1 + x^3) is rotated about the x-axis. What is the volume of the solid generated?,π/3 1,π/3 1,True,2.7922 seconds,π/3 1,True,0.4542 seconds,π/3 1,True,5.3957 seconds
Suppose today is Wednesday. What day of the week will it be 10^(10^(10)) days from now?,Sunday 1,,False,2.0122 seconds,Tuesday 1,False,1.3265 seconds,Wednesday 1,False,5.5003 seconds
"Water drips out of a hole at the vertex of an upside down cone at a rate of 3 cm^3 per minute. The
cone’s height and radius are 2 cm and 1 cm, respectively. At what rate does the height of the water change
when the water level is half a centimeter below the top of the cone? The volume of a cone is V = (π/3)*r^2*h,
where r is the radius and h is the height of the cone.",−16/(3π) cm/min 1,−4/(3π) cm/min 1,False,1.8573 seconds,−16/(3π) cm/min 1,True,2.1710 seconds,−16/(3π) cm/min 1,True,9.1497 seconds
"Consider the system of linear equations
w + 3x + 2y + 2z = 0
w + 4x + y = 0
3w + 5x + 10 y + 14z = 0
2w + 5x + 5y + 6z = 0
with solutions of the form (w, x, y, z), where w x, y, and z are real. Which of the following statements is FALSE?","Every solution is a scalar multiple of (-5, 1, 1, 0). 1","Every solution is a scalar multiple of (-5, 1, 1, 0). 1",True,0.5478 seconds,The system has infinitely many solutions. 1,False,2.6584 seconds,The system has infinitely many solutions. 1,False,7.4807 seconds
"If c > 0 and f(x) = e^x - cx for all real numbers x, then the minimum value of f is",f(log c) 1,f(log c) 1,True,0.1142 seconds,f(1/c) 1,False,1.0688 seconds,f(c) 1,False,5.9193 seconds
"Suppose A is a 3 × 3 matrix such that det(A − λI) = −λ^3 + 3λ^2 + λ − 3, where I is the 3 × 3 identity matrix. Which of the following are TRUE of A?
I. The trace of A is 3.
II. The determinate of A is −3.
III. The matrix A has eigenvalues −3 and 1.",I and II only 1,I only 1,False,2.4372 seconds,III only 1,False,2.4706 seconds,I and II only 1,True,6.9746 seconds
Let y = f(x) be a solution of the differential equation x dy + (y - xe^x) dx = 0 such that y = 0 when x = 1. What is the value of f(2)?,e^2/2 1,2e 1,False,1.6430 seconds,e^2/2 1,True,1.5000 seconds,e^2/2 1,True,5.5936 seconds
"A fair coin is to be tossed 100 times, with each toss resulting in a head or a tail. If H is the total number of heads and T is the total number of tails, which of the following events has the greatest probability?",H >= 48 and T >= 48 1,H >= 48 and T >= 48 1,True,1.9174 seconds,H = 50 1,False,2.6584 seconds,,False,4.3938 seconds
"Statement 1 | Suppose f : [a, b] is a function and suppose f has a local maximum. f'(x) must exist and equal 0? Statement 2 | There exist non-constant continuous maps from R to Q.","False, False 1","False, False 1",True,2.4142 seconds,"False, False 1",True,1.3272 seconds,"True, True 1",False,7.1496 seconds
"Let I != A != -I, where I is the identity matrix and A is a real 2 x 2 matrix. If A = A^(-1), then the trace of A is",0 1,0 1,True,2.8275 seconds,-1 1,False,1.5814 seconds,-1 1,False,6.7629 seconds
"A total of x feet of fencing is to form three sides of a level rectangular yard. What is the maximum possible area of the yard, in terms of x ?",x^2/8 1,x^2/9 1,False,0.3928 seconds,,False,1.7048 seconds,x^2/8 1,True,8.0206 seconds
"Statement 1 | If A is connected, the closure of A must be connected. Statement 2 | Every continuous function f : (0, 1) → (0, 1) has a fixed point.","True, False 1","True, False 1",True,2.8277 seconds,"False, True 1",False,0.8310 seconds,"True, False 1",True,3.1674 seconds
Which of the following sets has the greatest cardinality?,"The set of all functions from R to {0, 1} 1","The set of all functions from R to {0, 1} 1",True,0.5051 seconds,The set of all functions from Z to Z 1,False,1.9237 seconds,The set of all functions from Z to Z 1,False,3.5051 seconds
"Let f(x) be a function whose graph passes through the origin. If f(2n) = n^2 + f[2(n - 1)] for every integer n, what is the value of f(8)?",30 1,30 1,True,1.6036 seconds,32 1,False,0.7247 seconds,30 1,True,4.1406 seconds
How many structurally distinct Abelian groups have order 72?,6 1,6 1,True,2.4672 seconds,6 1,True,1.8039 seconds,6 1,True,5.1336 seconds
"If the finite group G contains a subgroup of order seven but no element (other than the identity) is its own inverse, then the order of G could be",35 1,35 1,True,2.6113 seconds,35 1,True,2.9689 seconds,35 1,True,5.5827 seconds
"Let f(x, y) = x^3 + y^3 + 3xy for all real x and y. Then there exist distinct points P and Q such that f has a",local maximum at P and a saddle point at Q 1,local maximum at P and a saddle point at Q 1,True,1.5982 seconds,local maximum at P and a saddle point at Q 1,True,0.9911 seconds,local minimum at P and a saddle point at Q 1,False,4.0394 seconds
"If A is a subset of the real line R and A contains each rational number, which of the following must be true?","If A is closed, then A = R. 1","If A is closed, then A = R. 1",True,2.4545 seconds,"If A is closed, then A = R. 1",True,0.4105 seconds,"If A is closed, then A = R. 1",True,4.4378 seconds
